{
  "version": "1.0.0",
  "language": "es",
  "lastDatasetReview": "2026-09-07",
  "disclaimer": "Información general basada en fuentes oficiales. No constituye asesoría legal ni garantiza el resultado de una solicitud.",
  "actionDefinitions": {
    "access": "Solicitar acceso o contenido",
    "billing": "Cancelar facturación",
    "close": "Cerrar cuenta",
    "deactivate": "Desactivar cuenta",
    "delete": "Eliminar cuenta",
    "funds": "Gestionar fondos o saldo",
    "memorialize": "Convertir en conmemorativa",
    "other": "Otra solicitud autorizada",
    "transfer": "Transferir contenido"
  },
  "platforms": [
    {
      "id": "apple",
      "name": "Apple",
      "category": "Cuenta y almacenamiento",
      "summary": "Apple permite solicitar acceso limitado o eliminación. Un contacto para legado con clave de acceso tiene la ruta más directa; sin esa clave pueden exigirse documentos legales adicionales.",
      "regionNote": "Global, con requisitos legales variables por país o región.",
      "actions": [
        { "id": "access", "label": "Solicitar acceso" },
        { "id": "delete", "label": "Solicitar eliminación" }
      ],
      "eligibleRequesters": [
        "Contacto para legado designado por el titular.",
        "Representante legal, heredero o familiar que cumpla los requisitos de su jurisdicción."
      ],
      "requirements": [
        "Clave de acceso del contacto para legado y certificado de defunción, si existe esa designación.",
        "Para otras rutas: certificado de defunción y posible orden judicial u otra documentación legal aceptada en la región.",
        "Cuenta Apple propia para ciertas solicitudes de eliminación."
      ],
      "steps": [
        "Confirma si existe una clave de contacto para legado.",
        "Revisa en la fuente oficial la ruta y los documentos aplicables a tu país.",
        "Inicia la solicitud únicamente en el sitio de Legado Digital de Apple o con Soporte de Apple."
      ],
      "warnings": [
        "Apple no puede desbloquear un dispositivo protegido por código sin borrarlo.",
        "Algunos datos cifrados de extremo a extremo y compras no pueden entregarse.",
        "No compartas la clave de acceso fuera del proceso oficial."
      ],
      "officialSource": {
        "title": "Request access to a deceased family member’s Apple Account",
        "url": "https://support.apple.com/en-la/102431",
        "language": "en"
      },
      "verification": { "status": "verified", "reviewedAt": "2026-09-07", "sourceType": "official" }
    },
    {
      "id": "google",
      "name": "Google",
      "category": "Cuenta, correo y archivos",
      "summary": "Google recibe solicitudes para cerrar una cuenta, solicitar fondos o, en ciertas circunstancias, obtener contenido. Cada caso se revisa y Google no entrega contraseñas.",
      "regionNote": "Proceso global; la documentación y el resultado dependen del caso y la jurisdicción.",
      "actions": [
        { "id": "close", "label": "Cerrar cuenta" },
        { "id": "access", "label": "Solicitar contenido" },
        { "id": "funds", "label": "Solicitar fondos" }
      ],
      "eligibleRequesters": [
        "Familiares directos.",
        "Representantes legales de la persona fallecida."
      ],
      "requirements": [
        "Identificación y datos de contacto del solicitante.",
        "Información de la persona fallecida y de su cuenta.",
        "Prueba de fallecimiento y documentación adicional solicitada durante la revisión."
      ],
      "steps": [
        "Elige en el formulario oficial si buscas cerrar la cuenta, solicitar fondos u obtener datos.",
        "Lee las consecuencias antes de cerrar: luego no se puede pedir el contenido de esa cuenta.",
        "Envía la documentación solamente mediante el flujo oficial de Google."
      ],
      "warnings": [
        "Google no proporciona contraseñas ni datos de acceso.",
        "La entrega de contenido no está garantizada.",
        "Solicitar el cierre antes de terminar una petición de contenido puede impedir recuperarlo."
      ],
      "officialSource": {
        "title": "Submit a request regarding a deceased user's account",
        "url": "https://support.google.com/accounts/troubleshooter/6357590?hl=en",
        "language": "en"
      },
      "verification": { "status": "verified", "reviewedAt": "2026-09-07", "sourceType": "official" }
    },
    {
      "id": "facebook",
      "name": "Facebook",
      "category": "Red social",
      "summary": "Facebook permite convertir un perfil en conmemorativo o solicitar su eliminación. El acceso al perfil conmemorativo queda bloqueado y un contacto de legado solo tiene funciones limitadas.",
      "regionNote": "Disponible en las regiones donde opera Facebook; los documentos pueden variar.",
      "actions": [
        { "id": "memorialize", "label": "Convertir en conmemorativa" },
        { "id": "delete", "label": "Solicitar eliminación" }
      ],
      "eligibleRequesters": [
        "Una persona que informe el fallecimiento y aporte prueba válida para conmemorar.",
        "Familiar directo verificado o representante autorizado para solicitar eliminación.",
        "Contacto de legado previamente designado para funciones limitadas tras la conmemoración."
      ],
      "requirements": [
        "Enlace del perfil y datos de la persona fallecida.",
        "Prueba de fallecimiento, como certificado, obituario u otra evidencia aceptada.",
        "Para eliminación, prueba de parentesco directo o autoridad legal cuando Facebook la solicite."
      ],
      "steps": [
        "Decide entre conservar el perfil como conmemorativo o pedir su eliminación.",
        "Abre desde la ayuda oficial el formulario correspondiente.",
        "Entrega documentos solo en el formulario de Facebook."
      ],
      "warnings": [
        "Nadie puede iniciar sesión en una cuenta conmemorativa.",
        "Un contacto de legado no puede leer mensajes ni editar publicaciones anteriores.",
        "La eliminación es distinta de la conmemoración y exige mayor autoridad."
      ],
      "officialSource": {
        "title": "Solicitar que una cuenta se convierta en conmemorativa o se elimine",
        "url": "https://www.facebook.com/help/1111566045566400?locale=es_LA",
        "language": "es"
      },
      "verification": { "status": "verified", "reviewedAt": "2026-09-07", "sourceType": "official" }
    },
    {
      "id": "microsoft",
      "name": "Microsoft",
      "category": "Correo, cuenta y almacenamiento",
      "summary": "Microsoft generalmente no entrega información a terceros. Sin acceso existente, una solicitud de contenido suele requerir una citación u orden judicial válida, con excepciones regionales.",
      "regionNote": "Global, con rutas específicas para Alemania, China y otras jurisdicciones.",
      "actions": [
        { "id": "access", "label": "Solicitar acceso legal" },
        { "id": "billing", "label": "Detener suscripciones" },
        { "id": "close", "label": "Cierre por inactividad" }
      ],
      "eligibleRequesters": [
        "Representante legal que pueda obtener y notificar una orden judicial válida.",
        "Herederos que cumplan la ruta regional especial indicada por Microsoft."
      ],
      "requirements": [
        "Orden judicial o citación válida para solicitudes de contenido en la ruta general.",
        "Prueba de fallecimiento, identidad y sucesión para rutas regionales que lo permitan.",
        "Datos del servicio y de la cuenta involucrada."
      ],
      "steps": [
        "Revisa primero la sección regional de la política oficial.",
        "Cancela suscripciones mediante el banco o emisor de la tarjeta cuando no tengas acceso.",
        "Busca orientación legal local antes de intentar una solicitud judicial de contenido."
      ],
      "warnings": [
        "Microsoft indica que no es necesario avisarle del fallecimiento para el cierre automático.",
        "Las cuentas pueden cerrarse tras dos años de inactividad; OneDrive y correo tienen plazos propios.",
        "Esta guía no sustituye asesoría jurídica sobre órdenes judiciales."
      ],
      "officialSource": {
        "title": "Accessing Outlook.com, OneDrive and other Microsoft services when someone has died",
        "url": "https://support.microsoft.com/en-us/accounts-billing/manage/accessing-outlook-com-onedrive-and-other-microsoft-services-when-someone-has-died",
        "language": "en"
      },
      "verification": { "status": "verified", "reviewedAt": "2026-09-07", "sourceType": "official" }
    },
    {
      "id": "github",
      "name": "GitHub",
      "category": "Código y repositorios",
      "summary": "GitHub trabaja con personas autorizadas para decidir qué ocurre con el contenido de una cuenta, incluido transferir repositorios públicos o cancelar cobros.",
      "regionNote": "Política global de GitHub; pueden aplicar requisitos legales locales.",
      "actions": [
        { "id": "transfer", "label": "Transferir repositorios públicos" },
        { "id": "billing", "label": "Cancelar facturación" },
        { "id": "other", "label": "Otra solicitud autorizada" }
      ],
      "eligibleRequesters": [
        "Familiar más cercano.",
        "Sucesor previamente designado en GitHub.",
        "Otra persona autorizada, como colaborador o socio comercial, según el caso."
      ],
      "requirements": [
        "Nombre y datos de contacto del solicitante.",
        "Nombre y usuario de GitHub de la persona fallecida.",
        "Relación con el titular y acción solicitada.",
        "Posible identificación, certificado de defunción y prueba de autorización si GitHub los pide."
      ],
      "steps": [
        "Abre el portal de Soporte de GitHub desde la política oficial.",
        "Describe tu relación y la acción concreta que solicitas.",
        "Espera la petición de documentos adicionales antes de enviar material sensible."
      ],
      "warnings": [